{
  "schema": "index/v1",
  "month": "2026-09",
  "updatedAt": "2026-09-30T23:50:05Z",
  "logs": {
    "audit": [
      {
        "at": "2026-09-30T11:00:05Z",
        "size": 182350,
        "prev": null,
        "root": "dCDqzIw0c9eBlp05NvL38rh4MRR9WIr+0Q7zP3PI5e0=",
        "record": "data/v1/audit/witness/2026/09/30/110005Z.json"
      },
      {
        "at": "2026-09-30T11:05:07Z",
        "size": 182407,
        "prev": 182350,
        "root": "eMTdTmaEiulDwG7MVKGqfb43OVUNmO/+t6GtxWoR93w=",
        "record": "data/v1/audit/witness/2026/09/30/110507Z.json"
      },
      {
        "at": "2026-09-30T11:10:03Z",
        "size": 182443,
        "prev": 182407,
        "root": "E0UcluHeFLz0MyVDTPtHM+F8YgG6aJCb3xAuPdU7mDk=",
        "record": "data/v1/audit/witness/2026/09/30/111003Z.json"
      },
      {
        "at": "2026-09-30T11:15:03Z",
        "size": 182492,
        "prev": 182443,
        "root": "2s5G6npD7ABw7JNoT3LySoYsz3aADkTVxkW2rHzv75I=",
        "record": "data/v1/audit/witness/2026/09/30/111503Z.json"
      },
      {
        "at": "2026-09-30T11:20:02Z",
        "size": 182564,
        "prev": 182492,
        "root": "oddBj9CJtzdDsZHStqahPfCCxNCT/XIfXqFrPegZ7FU=",
        "record": "data/v1/audit/witness/2026/09/30/112002Z.json"
      },
      {
        "at": "2026-09-30T11:25:04Z",
        "size": 182586,
        "prev": 182564,
        "root": "KhAQQ9O3F/B2QneGrS1gawG1Egkv8JMwdIXQKsBT9nU=",
        "record": "data/v1/audit/witness/2026/09/30/112504Z.json"
      },
      {
        "at": "2026-09-30T11:30:03Z",
        "size": 182619,
        "prev": 182586,
        "root": "Rqc6JkK449PmNgtfDA7FBQAkj2xQl57UHGaB28E2n+Y=",
        "record": "data/v1/audit/witness/2026/09/30/113003Z.json"
      },
      {
        "at": "2026-09-30T11:35:04Z",
        "size": 182693,
        "prev": 182619,
        "root": "4okDMNDVNssY0w4QFlILkJfMcKBjNpMSXhHWOfkH044=",
        "record": "data/v1/audit/witness/2026/09/30/113504Z.json"
      },
      {
        "at": "2026-09-30T11:40:05Z",
        "size": 182707,
        "prev": 182693,
        "root": "XGX1Qs6aSXqcvmsEBbMmWXHTShBsEOOpikUtFIs2jEI=",
        "record": "data/v1/audit/witness/2026/09/30/114005Z.json"
      },
      {
        "at": "2026-09-30T11:50:06Z",
        "size": 182750,
        "prev": 182707,
        "root": "+X2L8Kv4bLbbnp+brHayWP3FtHzS/KWSsuD0Uf3fjs0=",
        "record": "data/v1/audit/witness/2026/09/30/115006Z.json"
      },
      {
        "at": "2026-09-30T12:00:02Z",
        "size": 182781,
        "prev": 182750,
        "root": "JPHDJgH51ZxqGR6I04NaqfrMu6DER2N/Fv3mHMVlElk=",
        "record": "data/v1/audit/witness/2026/09/30/120002Z.json"
      },
      {
        "at": "2026-09-30T12:05:05Z",
        "size": 182845,
        "prev": 182781,
        "root": "oGLWZJJ27pwqvcRg8GSQdrlETv6APhspM7zd9wKsb8Q=",
        "record": "data/v1/audit/witness/2026/09/30/120505Z.json"
      },
      {
        "at": "2026-09-30T12:10:04Z",
        "size": 182853,
        "prev": 182845,
        "root": "UrnawB7Imn2i91MX98+gpMiaMaZm1Sb5uuOrRDITAvg=",
        "record": "data/v1/audit/witness/2026/09/30/121004Z.json"
      },
      {
        "at": "2026-09-30T12:15:05Z",
        "size": 182879,
        "prev": 182853,
        "root": "3PA5MRRa61LjOEBcABT9ySAOvK4TdYtS5iggm8UdIuQ=",
        "record": "data/v1/audit/witness/2026/09/30/121505Z.json"
      },
      {
        "at": "2026-09-30T12:20:04Z",
        "size": 182895,
        "prev": 182879,
        "root": "ZSNOycKhqxP3Svv5Hi4sbpmcg9RU9ROAMKJFtkF7J40=",
        "record": "data/v1/audit/witness/2026/09/30/122004Z.json"
      },
      {
        "at": "2026-09-30T12:25:07Z",
        "size": 182942,
        "prev": 182895,
        "root": "9avZQ0+jBJelHxj9JJdeNwqQ9MXb5ToYLw87Jh9nEGM=",
        "record": "data/v1/audit/witness/2026/09/30/122507Z.json"
      },
      {
        "at": "2026-09-30T12:30:06Z",
        "size": 182978,
        "prev": 182942,
        "root": "pxZ+71VuVvAHMUHMLK7pymNEKjDEoiYsh6ZEhqrhpM8=",
        "record": "data/v1/audit/witness/2026/09/30/123006Z.json"
      },
      {
        "at": "2026-09-30T12:35:02Z",
        "size": 183031,
        "prev": 182978,
        "root": "tQFfhMNKRv5q61fvWUPl1SIvFMxrPYxWStYCq+inOfc=",
        "record": "data/v1/audit/witness/2026/09/30/123502Z.json"
      },
      {
        "at": "2026-09-30T12:40:07Z",
        "size": 183058,
        "prev": 183031,
        "root": "/GarvyXDbNy2yrYpM6Xuh26qibAzL/szhx9zCxv2FdM=",
        "record": "data/v1/audit/witness/2026/09/30/124007Z.json"
      },
      {
        "at": "2026-09-30T12:45:06Z",
        "size": 183122,
        "prev": 183058,
        "root": "xA9vSQBfcm0ssnnbT0lcmwaUSVw9HBrcdCTjzWpq+Tc=",
        "record": "data/v1/audit/witness/2026/09/30/124506Z.json"
      },
      {
        "at": "2026-09-30T12:50:06Z",
        "size": 183134,
        "prev": 183122,
        "root": "bjXLcTJ8WFNc7L/1dlkpKypO6qBfqhEXa9KdwE44rCI=",
        "record": "data/v1/audit/witness/2026/09/30/125006Z.json"
      },
      {
        "at": "2026-09-30T12:55:03Z",
        "size": 183174,
        "prev": 183134,
        "root": "o+fda5HLVvr5lwZRmpM8Q1YiHafl9yyV+Na+MnbvVBY=",
        "record": "data/v1/audit/witness/2026/09/30/125503Z.json"
      },
      {
        "at": "2026-09-30T13:00:02Z",
        "size": 183245,
        "prev": 183174,
        "root": "Zxx+gudAtnazNsPw0aHxKcqd5DiYu4v2+UwXVZn+baA=",
        "record": "data/v1/audit/witness/2026/09/30/130002Z.json"
      },
      {
        "at": "2026-09-30T13:05:03Z",
        "size": 183314,
        "prev": 183245,
        "root": "8vGOxC58uJgY9PlxOE1PDQuRDM6Hd0tVYqauaBgVZug=",
        "record": "data/v1/audit/witness/2026/09/30/130503Z.json"
      },
      {
        "at": "2026-09-30T13:10:06Z",
        "size": 183368,
        "prev": 183314,
        "root": "SZiT7WyYbHSRL51dlt/RQdDHLHX3DWJBbi8oh+9v0Jk=",
        "record": "data/v1/audit/witness/2026/09/30/131006Z.json"
      },
      {
        "at": "2026-09-30T13:15:07Z",
        "size": 183442,
        "prev": 183368,
        "root": "Uf1KLWzqYqLOR9dPjWv6RMjRo9KqKMnkL6Xzc3iwg9w=",
        "record": "data/v1/audit/witness/2026/09/30/131507Z.json"
      },
      {
        "at": "2026-09-30T13:20:04Z",
        "size": 183464,
        "prev": 183442,
        "root": "VXT57DGZypOhbhzqBVdd6X/0qO3lzhQDdAHNOEThh6o=",
        "record": "data/v1/audit/witness/2026/09/30/132004Z.json"
      },
      {
        "at": "2026-09-30T13:25:07Z",
        "size": 183525,
        "prev": 183464,
        "root": "GmwhDFr/ao9wtUUF05U/wCVAlvQlB9Uvo1+AYq0Rklk=",
        "record": "data/v1/audit/witness/2026/09/30/132507Z.json"
      },
      {
        "at": "2026-09-30T13:30:07Z",
        "size": 183581,
        "prev": 183525,
        "root": "zHn+hrRUl45RFHbLFcpEj8x+7pyilAEAvDsrtDtPrY4=",
        "record": "data/v1/audit/witness/2026/09/30/133007Z.json"
      },
      {
        "at": "2026-09-30T13:35:07Z",
        "size": 183608,
        "prev": 183581,
        "root": "FOsrI1d530aEfVH4WQZMSAoHOtJtbfCe86hPm0VevL4=",
        "record": "data/v1/audit/witness/2026/09/30/133507Z.json"
      },
      {
        "at": "2026-09-30T13:40:04Z",
        "size": 183644,
        "prev": 183608,
        "root": "Wp7CEygckIfW+4O6OkjCNZEJMXX9HNbIEl5/TpUFMWo=",
        "record": "data/v1/audit/witness/2026/09/30/134004Z.json"
      },
      {
        "at": "2026-09-30T13:45:05Z",
        "size": 183655,
        "prev": 183644,
        "root": "StOjPnkDN/JrqqH78KplwUWPdN6WyHC/0KihlVToiN8=",
        "record": "data/v1/audit/witness/2026/09/30/134505Z.json"
      },
      {
        "at": "2026-09-30T13:55:05Z",
        "size": 183673,
        "prev": 183655,
        "root": "DeFQ/t2ISoW4JZbJy14pdMZnJMlrFN/OefaNmjEXEKg=",
        "record": "data/v1/audit/witness/2026/09/30/135505Z.json"
      },
      {
        "at": "2026-09-30T14:00:07Z",
        "size": 183743,
        "prev": 183673,
        "root": "YgDCuJvp5pLln4KUtfMAvUWvBZXg9O/0aBf2B+lwW/s=",
        "record": "data/v1/audit/witness/2026/09/30/140007Z.json"
      },
      {
        "at": "2026-09-30T14:05:05Z",
        "size": 183786,
        "prev": 183743,
        "root": "Zu+egv2SUPtSfNbIQ6zXGviyLRCica2u5hXrq26OV4g=",
        "record": "data/v1/audit/witness/2026/09/30/140505Z.json"
      },
      {
        "at": "2026-09-30T14:10:03Z",
        "size": 183844,
        "prev": 183786,
        "root": "l4gBmU39xq9pyDIcdG7k7C/Exn22TkOYiZoG2zCq4as=",
        "record": "data/v1/audit/witness/2026/09/30/141003Z.json"
      },
      {
        "at": "2026-09-30T14:20:02Z",
        "size": 183858,
        "prev": 183844,
        "root": "LZe3XoyFSQdZ9jktpgWuY0keetRr9seN4wYURmuF4Xg=",
        "record": "data/v1/audit/witness/2026/09/30/142002Z.json"
      },
      {
        "at": "2026-09-30T14:25:04Z",
        "size": 183930,
        "prev": 183858,
        "root": "DTdbUl0Vczjl9Vwb6K84eTxefDGf2X5FeyF9TSbV4FE=",
        "record": "data/v1/audit/witness/2026/09/30/142504Z.json"
      },
      {
        "at": "2026-09-30T14:30:03Z",
        "size": 183992,
        "prev": 183930,
        "root": "pvzqwZfNPx9mJjQmv/KxSHfj6SLTwqrCenJ2050gUqs=",
        "record": "data/v1/audit/witness/2026/09/30/143003Z.json"
      },
      {
        "at": "2026-09-30T14:35:06Z",
        "size": 184065,
        "prev": 183992,
        "root": "wbrh3xa52QLoPGUlc4NgpavQmwwSp6w7eXwUs3qBGkE=",
        "record": "data/v1/audit/witness/2026/09/30/143506Z.json"
      },
      {
        "at": "2026-09-30T14:45:02Z",
        "size": 184124,
        "prev": 184065,
        "root": "1P73BOQC3rXwg5UA4J4PROBrqnOZ/1SwLzubx4djcjU=",
        "record": "data/v1/audit/witness/2026/09/30/144502Z.json"
      },
      {
        "at": "2026-09-30T14:50:03Z",
        "size": 184154,
        "prev": 184124,
        "root": "VaSshKDBayTpJI6dwpqnlsNGLb1exA9UcUOCZz67IOo=",
        "record": "data/v1/audit/witness/2026/09/30/145003Z.json"
      },
      {
        "at": "2026-09-30T14:55:03Z",
        "size": 184224,
        "prev": 184154,